<!DOCTYPE tokenLists SYSTEM "tokenLists.dtd">
<!-- See the DTD for more details -->
<tokenLists>
  <tokenList tagname="hydrocarbonFusedRingSystem" symbol="V"><!--the a is part of the multiplier and the e is assumed to be optional -->
    <token value="polyacene">cen</token>
    <token value="polyalene">len</token>
    <token value="polyaphene">phen</token><!--ambiguity between this and multiplier phenyl e.g. hexaphenylbenzene is resolved in the ComponentGenerator generally in favour of phenyl-->
    <token value="polyphenylene">phenylen</token>
    <token value="polynaphthylene">naphthylen</token>
    <token value="polyhelicene">helicen</token>
  </tokenList>
  
  <tokenList tagname="cyclo" symbol="C">
    <token value="cyclo">cyclo</token>
    <token value="cyclo">cyclo-</token>
  </tokenList>

  <tokenList tagname="hydro" symbol="y">
    <token value="dehydro">dehydro</token>
    <token value="hydro">hydro</token>
  </tokenList>
  <tokenList tagname="hydro" symbol="ú">
    <token value="perhydro">perhydro</token>
  </tokenList>

  <tokenList tagname="stereoChemistry" type="cisOrTrans" symbol="t">
    <token value="cis">cis</token>
    <token value="trans">trans</token>
  </tokenList>

  <tokenList tagname="ine" symbol="î"><!--used for amino acids-->
    <token value="ine">ine</token>
    <token value="ine">in</token>
  </tokenList>

  <tokenList tagname="group" type="substituent" subType="multiRadicalSubstituent" symbol="ó"><!--chalcogen replacement terms-->
    <token value="S" labels="none" outIDs="1,1" valType="SMILES" usableAsAJoiner="yes" acceptsAdditiveBonds="yes">thio</token>
    <token value="[SeH2]" labels="none" outIDs="1,1" valType="SMILES" usableAsAJoiner="yes" acceptsAdditiveBonds="yes">seleno</token>
    <token value="[TeH2]" labels="none" outIDs="1,1" valType="SMILES" usableAsAJoiner="yes" acceptsAdditiveBonds="yes">telluro</token>
  </tokenList>

  <tokenList tagname="suffix" type="root" symbol="Ñ">
    <token value="amine">ylamine</token>
  </tokenList>

  <tokenList tagname="polyCyclicSpiro" symbol="º">
    <token value="spirobi">spirobi</token>
    <token value="spirobi">spirobi-</token>
    <token value="spiroter">spiroter</token>
    <token value="spiroter">spiroter-</token>
  </tokenList>

  <tokenList tagname="polyCyclicSpiro" symbol="⌐">
    <token value="spiro">spiro</token>
    <token value="spiro">spiro-</token>
  </tokenList>

  <tokenList tagname="polyCyclicSpiro" symbol="╝">
    <token value="spiroOldMethod">spiro</token>
    <token value="spiroOldMethod">spiro-</token>
  </tokenList>

  <tokenList tagname="dlStereochemistry" symbol="╛">
    <token value="d">d-</token>
    <token value="l">l-</token>
    <token value="dl">dl-</token>
<!--used to distinguish amino acid D/L from carbohydrate D/L if desired-->
    <token value="ds">ds-</token>
    <token value="dg">dg-</token>
    <token value="ls">ls-</token>
    <token value="lg">lg-</token>
  </tokenList>

<!--As a purely non-detachable prefixe-->
	<tokenList tagname="subtractivePrefix" symbol="┐">
		<token value="O">deoxy</token>
		<token value="O">desoxy</token><!--older variant spelling-->
	</tokenList>

<!--As a detachable prefix (which could itself have non-detachable prefixes in the case where it is being treated as a non-detachable prefix)-->
	<tokenList tagname="subtractivePrefix" symbol="x">
		<token value="O">deoxy</token>
		<token value="O">desoxy</token><!--older variant spelling-->
	</tokenList>
</tokenLists>