<!DOCTYPE tokenLists SYSTEM "tokenLists.dtd">
<!-- See the DTD for more details -->
<tokenLists>
  <tokenList tagname="group" type="ring" subType="cyclicUnsaturableHydrocarbon" symbol="A">
    <token value="C12CC3CC4CC5C1.C24.C35" valType="SMILES" frontLocantsExpected="1,2">adamant</token>
    <token value="C12C3C4C11.C35C2C1C45" valType="SMILES">cub</token>
    <token value="C12C3C4C1C4C32" valType="SMILES">prism</token>
  </tokenList>

  <tokenList tagname="group" type="ring" subType="cyclicUnsaturableHydrocarbon" symbol="A">
    <!-- terpenes-->
    <token value="C123CCC4CC1.C24(C)C.C3" valType="SMILES">born</token>
      <token value="C123CCC4CC1.C24(C)C.C3" valType="SMILES">camph</token>
      <token value="C123CCC4CC1.C24(C)C.C3" valType="SMILES">bornyl</token>
    <token value="C12CC3CCC1C2(C)C.C3" valType="SMILES">car</token>
    <!--it's quicker to write out all forms of this than create a special case for menthane to allow things like 1-p-menthene-->
    <token value="C12CCC3CC1.C2.C3(C)C" valType="SMILES" defaultInLocant="3">menth</token>
    <token value="C12CCC3CC1.C2.C3(C)C" valType="SMILES" defaultInLocant="3">p-menth</token>
    <token value="C12CCC3CC1.C2.C3(C)C" valType="SMILES" defaultInLocant="3">para-menth</token>
    <token value="C12CC3CCC1.C2.C3(C)C" valType="SMILES">m-menth</token>
    <token value="C12CC3CCC1.C2.C3(C)C" valType="SMILES">meta-menth</token>
    <token value="C12C3CCCC1.C2.C3(C)C" valType="SMILES">o-menth</token>
    <token value="C12C3CCCC1.C2.C3(C)C" valType="SMILES">ortho-menth</token>
    <token value="C12CCC(CC2)C1" valType="SMILES">norborn</token>
      <token value="C12CCC(CC2)C1" valType="SMILES">norcamph</token>
      <token value="C12CCC(CC2)C1" valType="SMILES">norbornyl</token>
    <token value="C12CCCCC2C1" valType="SMILES">norcar</token>
    <token value="C12CCCC(C2)C1" valType="SMILES">norpin</token>
    <token value="C12C3CCC4C156.C24.C5.C6.C3" valType="SMILES">pin</token>
    <token value="C123CCC4C1C2.C3(C)C.C4" valType="SMILES">thuj</token>
  </tokenList>
</tokenLists>