<!DOCTYPE tokenLists SYSTEM "tokenLists.dtd">
<!-- See the DTD for more details -->
<tokenLists>
  <tokenList tagname="hydrocarbonFusedRingSystem" symbol="V"><!--the a is part of the multiplier and the e is assumed to be optional -->
    <token value="polyacene">cen</token>
    <token value="polyalene">len</token>
    <token value="polyaphene">phen</token><!--ambiguity between this and multiplier phenyl e.g. hexaphenylbenzene is resolved in the ComponentGenerator generally in favour of phenyl-->
    <token value="polyphenylene">phenylen</token>
    <token value="polynaphthylene">naphthylen</token>
    <token value="polyhelicene">helicen</token>
  </tokenList>
  
  <tokenList tagname="cyclo" symbol="C">
    <token value="cyclo">cyclo</token>
    <token value="cyclo">cyclo-</token>
  </tokenList>

  <tokenList tagname="hydro" symbol="y">
    <token value="dehydro">dehydro</token>
    <token value="hydro">hydro</token>
  </tokenList>
  <tokenList tagname="hydro" symbol="ú">
    <token value="perhydro">perhydro</token>
  </tokenList>

  <tokenList tagname="stereoChemistry" type="cisOrTrans" symbol="t">
    <token value="cis">cis</token>
    <token value="trans">trans</token>
  </tokenList>

  <tokenList tagname="ine" symbol="î"><!--used for amino acids-->
    <token value="ine">ine</token>
    <token value="ine">in</token>
  </tokenList>

  <tokenList tagname="group" type="substituent" subType="multiRadicalSubstituent" symbol="ó"><!--chalcogen replacement terms-->
    <token value="S" labels="none" outIDs="1,1" valType="SMILES" usableAsAJoiner="yes" acceptsAdditiveBonds="yes">thio</token>
    <token value="[SeH2]" labels="none" outIDs="1,1" valType="SMILES" usableAsAJoiner="yes" acceptsAdditiveBonds="yes">seleno</token>
    <token value="[TeH2]" labels="none" outIDs="1,1" valType="SMILES" usableAsAJoiner="yes" acceptsAdditiveBonds="yes">telluro</token>
  </tokenList>

  <tokenList tagname="suffix" type="root" symbol="Ñ">
    <token value="amine">ylamine</token>
  </tokenList>

  <tokenList tagname="polyCyclicSpiro" symbol="º">
    <token value="spirobi">spirobi</token>
    <token value="spirobi">spirobi-</token>
    <token value="spiroter">spiroter</token>
    <token value="spiroter">spiroter-</token>
  </tokenList>

  <tokenList tagname="polyCyclicSpiro" symbol="⌐">
    <token value="spiro">spiro</token>
    <token value="spiro">spiro-</token>
  </tokenList>

  <tokenList tagname="polyCyclicSpiro" symbol="╝">
    <token value="spiroOldMethod">spiro</token>
    <token value="spiroOldMethod">spiro-</token>
  </tokenList>

  <tokenList tagname="dlStereochemistry" symbol="╛">
    <token value="d">d-</token>
    <token value="l">l-</token>
    <token value="dl">dl-</token>
<!--used to distinguish amino acid D/L from carbohydrate D/L if desired-->
    <token value="ds">ds-</token>
    <token value="dg">dg-</token>
    <token value="ls">ls-</token>
    <token value="lg">lg-</token>
  </tokenList>

<!--As a purely non-detachable prefixe-->
  <tokenList tagname="subtractivePrefix" symbol="┐">
    <token value="O">deoxy</token>
    <token value="O">desoxy</token><!--older variant spelling-->
  </tokenList>

<!--As a detachable prefix (which could itself have non-detachable prefixes in the case where it is being treated as a non-detachable prefix)-->
  <tokenList tagname="subtractivePrefix" symbol="x">
    <token value="O">deoxy</token>
    <token value="O">desoxy</token><!--older variant spelling-->
  </tokenList>
  
  <tokenList tagname="NA" symbol="h" ignoreWhenWritingXML="yes"><!--an optional hyphen-->
    <token value="-">-</token>
  </tokenList>
  
  <tokenList tagname="hyphen" symbol="ä"><!--an intersubstituent seperator-->
    <token value="-">-</token>
    <token value=",">,</token>
  </tokenList>
  
  <tokenList tagname="openbracket" symbol="o"><!--an open bracket-->
    <token value="(">(</token>
    <token value="[">[</token>
    <token value="{">{</token>
  </tokenList>
  
  <tokenList tagname="closebracket" symbol="c"><!--a close bracket-->
    <token value=")">)</token>
    <token value="]">]</token>
    <token value="}">}</token>
  </tokenList>
  
  <tokenList tagname="NA" symbol="T" ignoreWhenWritingXML="yes"><!--an open bracket that forms a pair of optional brackets-->
    <token value="(">(</token>
    <token value="[">[</token>
    <token value="{">{</token>
  </tokenList>
  
  <tokenList tagname="NA" symbol="U" ignoreWhenWritingXML="yes"><!--a close bracket that forms a pair of optional brackets-->
    <token value=")">)</token>
    <token value="]">]</token>
    <token value="}">}</token>
  </tokenList>
  
  <tokenList tagname="structuralOpenBracket" symbol="q"><!--an open bracket that disambiguates a specific type of nomenclature e.g. ring assembly-->
    <token value="(">(</token>
    <token value="[">[</token>
    <token value="{">{</token>
  </tokenList>
  
  <tokenList tagname="structuralCloseBracket" symbol="Q"><!--a close bracket that disambiguates a specific type of nomenclature e.g. ring assembly-->
    <token value=")">)</token>
    <token value="]">]</token>
    <token value="}">}</token>
  </tokenList>
  
  <tokenList tagname="NA" symbol="¬" ignoreWhenWritingXML="yes"><!--an optional a-->
    <token value="a">a</token>
  </tokenList>
  
  <tokenList tagname="NA" symbol="Z" ignoreWhenWritingXML="yes"><!--an optional e-->
    <token value="e">e</token>
  </tokenList>
  
  <tokenList tagname="NA" symbol="Y" ignoreWhenWritingXML="yes"><!--an optional o-->
    <token value="o">o</token>
  </tokenList>
  
  <tokenList tagname="bridgeFormingO" symbol="╡"><!--an o used to indicate a prefix is a bridge e.g. the o in ethano-->
    <token value="o">o</token>
  </tokenList>
  
  <tokenList tagname="NA" symbol="ç" ignoreWhenWritingXML="yes"><!--a comma used as a delimiter-->
    <token value=",">,</token>
  </tokenList>

  <tokenList tagname="suffix" symbol="£" type="root" subType="terminal"><!--an implicit ic-->
    <token value="ic"></token>
  </tokenList>
  
  <tokenList tagname="suffix" symbol="₧" type="inline"><!--an o meaning yl e.g. glycino-->
    <token value="oMeaningYl">o</token>
  </tokenList>
  
  <tokenList tagname="NA" symbol="é" ignoreWhenWritingXML="yes"><!--endOfSubstituent-->
    <token value="endOfSubstituent"></token>
  </tokenList>
  
  <tokenList tagname="NA" symbol="â" ignoreWhenWritingXML="yes"><!--endOfMainGroup-->
    <token value="endOfMainGroup"></token>
  </tokenList>
  
  <tokenList tagname="NA" symbol="û" ignoreWhenWritingXML="yes"><!--endOfFunctionalGroup-->
    <token value="endOfFunctionalGroup"></token>
  </tokenList>
</tokenLists>