<!DOCTYPE tokenLists SYSTEM "tokenLists.dtd">
<!-- 3AA-2.2 Natural amino acids -->
<!-- Histidine numbering uses Organic Chemistry numbering, not Biochemistry numbering -->
<!-- 3AA-2.3 added common examples of 'homo'-amino acids -->
<!-- 3AA-2.4 added common examples of 'nor'-amino acids -->
<!-- 3AA-4.4 added common examples of 'allo'-amino acids -->
<!-- 3AA-9.2 added common examples of 'iso'-amino acids -->
<!-- L- and D- must be in lower case-->
<tokenLists>
  <tokenList tagname="group" type="aminoAcid" subType="endInIne" symbol="ë" >
    <token labels="/2,alpha/3,beta/1//" valType="SMILES" value="N[C@@H](C)C(O)=O">alan</token>
    <token labels="/2/3/4/5//guanidino-C/omega/omega'/1//" valType="SMILES" value="N[C@@H](CCCNC(N)=N)C(O)=O">argin</token>
    <token labels="/2,alpha/3,beta/4,delta///1//" valType="SMILES" value="N[C@@H](CC(N)=O)C(O)=O">asparag</token>
    <token labels="/2,alpha/3,beta/4,delta///1//" valType="SMILES" value="N[C@@H](CC(O)=O)C(N)=O">isoasparag</token>
    <token labels="/2,alpha/3,beta//1//" valType="SMILES" value="N[C@@H](CS)C(O)=O">cyste</token>
    <token labels="/2,alpha/3,beta/4,delta/5///1//" valType="SMILES" value="N[C@@H](CCC(N)=O)C(O)=O">glutam</token>
    <token labels="/2,alpha/3,beta/4,delta/5///1//" valType="SMILES" value="N[C@@H](CCC(O)=O)C(N)=O">isoglutam</token>
    <token labels="/2,alpha/1//" valType="SMILES" value="NCC(O)=O">glyc</token>
    <token labels="/alpha/beta/4/5/1,tele,tau/2/3,pros,pi///" valType="SMILES" value="N[C@@H](Cc1cncn1)C(O)=O">histid</token>
    <token labels="/2,alpha/3,beta/3'/4,gamma/5,delta/1//" valType="SMILES" value="N[C@@H]([C@@H](C)CC)C(O)=O">isoleuc</token>
    <token labels="/2,alpha/3,beta/3'/4,gamma/5,delta/1//" valType="SMILES" value="N[C@@H]([C@H](C)CC)C(O)=O">alloisoleuc</token>
    <token labels="/2,alpha/3,beta/4,gamma/5',delta'/5,delta/1//" valType="SMILES" value="N[C@@H](CC(C)C)C(O)=O">leuc</token>
    <token labels="/2,alpha/3,beta/4,gamma/5,delta/6,epsilon//1//" valType="SMILES" value="N[C@@H](CCCCN)C(O)=O">lys</token>
    <token labels="/2,alpha/3,beta/4,gamma//methyl/1//" valType="SMILES" value="N[C@@H](CCSC)C(O)=O">methion</token>
    <token labels="/alpha/beta/1/2/3/4/5/6///" valType="SMILES" value="N[C@@H](Cc1ccccc1)C(O)=O">phenylalan</token>
    <token labels="///2/1/5/4/3" valType="SMILES" value="O=C(O)[C@H]1NCCC1">prol</token>
    <token labels="/2,alpha/3,beta//1//" valType="SMILES" value="N[C@@H](CO)C(O)=O">ser</token>
    <token labels="/2,alpha/3,beta//4,gamma/1//" valType="SMILES" value="N[C@@H]([C@H](O)C)C(O)=O">threon</token>
    <token labels="/2,alpha/3,beta//4,gamma/1//" valType="SMILES" value="N[C@@H]([C@@H](O)C)C(O)=O">allothreon</token>
    <token labels="/alpha/beta/1/2/3/4/5/6////" valType="SMILES" value="N[C@@H](Cc1ccc(cc1)O)C(O)=O">tyros</token>
    <token labels="/2,alpha/3,beta/4',gamma'/4,gamma/1//" valType="SMILES" value="N[C@@H](C(C)C)C(O)=O">val</token>
    <token labels="/2,alpha/3,beta/4,gamma////" valType="SMILES" value="N[C@@H](CCO)C(O)=O">homoser</token>
    <token labels="/2,alpha/3,beta/4,gamma////" valType="SMILES" value="N[C@@H](CCS)C(O)=O">homocyste</token>
    <token labels="/2,alpha/3,beta/4,gamma/5,delta///" valType="SMILES" value="N[C@@H](CCC)C(O)=O">norval</token>
    <token labels="/2,alpha/3,beta/4,gamma/5,delta/6,epsilon///" valType="SMILES" value="N[C@@H](CCCC)C(O)=O">norleuc</token>
    <token labels="none" valType="SMILES" value="N[C@@H](CSSCC(N)C(=O)O)C(O)=O">cyst</token>

    <token labels="/2,alpha/3,beta/1//" valType="SMILES" value="N[C@@H](C)C(O)=O">l-alan</token>
    <token labels="/2/3/4/5//guanidino-C/omega/omega'/1//" valType="SMILES" value="N[C@@H](CCCNC(N)=N)C(O)=O">l-argin</token>
    <token labels="/2,alpha/3,beta/4,delta///1//" valType="SMILES" value="N[C@@H](CC(N)=O)C(O)=O">l-asparag</token>
    <token labels="/2,alpha/3,beta/4,delta///1//" valType="SMILES" value="N[C@@H](CC(O)=O)C(N)=O">l-isoasparag</token>
    <token labels="/2,alpha/3,beta//1//" valType="SMILES" value="N[C@@H](CS)C(O)=O">l-cyste</token>
    <token labels="/2,alpha/3,beta/4,delta/5///1//" valType="SMILES" value="N[C@@H](CCC(N)=O)C(O)=O">l-glutam</token>
    <token labels="/2,alpha/3,beta/4,delta/5///1//" valType="SMILES" value="N[C@@H](CCC(O)=O)C(N)=O">l-isoglutam</token>
    <token labels="/alpha/beta/4/5/1,tele,tau/2/3,pros,pi///" valType="SMILES" value="N[C@@H](Cc1cncn1)C(O)=O">l-histid</token>
    <token labels="/2,alpha/3,beta/3'/4,gamma/5,delta/1//" valType="SMILES" value="N[C@@H]([C@@H](C)CC)C(O)=O">l-isoleuc</token>
    <token labels="/2,alpha/3,beta/3'/4,gamma/5,delta/1//" valType="SMILES" value="N[C@@H]([C@H](C)CC)C(O)=O">l-alloisoleuc</token>
    <token labels="/2,alpha/3,beta/4,gamma/5',delta'/5,delta/1//" valType="SMILES" value="N[C@@H](CC(C)C)C(O)=O">l-leuc</token>
    <token labels="/2,alpha/3,beta/4,gamma/5,delta/6,epsilon//1//" valType="SMILES" value="N[C@@H](CCCCN)C(O)=O">l-lys</token>
    <token labels="/2,alpha/3,beta/4,gamma//methyl/1//" valType="SMILES" value="N[C@@H](CCSC)C(O)=O">l-methion</token>
    <token labels="/alpha/beta/1/2/3/4/5/6///" valType="SMILES" value="N[C@@H](Cc1ccccc1)C(O)=O">l-phenylalan</token>
    <token labels="///2/1/5/4/3" valType="SMILES" value="O=C(O)[C@H]1NCCC1">l-prol</token>
    <token labels="/2,alpha/3,beta//1//" valType="SMILES" value="N[C@@H](CO)C(O)=O">l-ser</token>
    <token labels="/2,alpha/3,beta//4,gamma/1//" valType="SMILES" value="N[C@@H]([C@H](O)C)C(O)=O">l-threon</token>
    <token labels="/2,alpha/3,beta//4,gamma/1//" valType="SMILES" value="N[C@@H]([C@@H](O)C)C(O)=O">l-allothreon</token>
    <token labels="/alpha/beta/1/2/3/4/5/6////" valType="SMILES" value="N[C@@H](Cc1ccc(cc1)O)C(O)=O">l-tyros</token>
    <token labels="/2,alpha/3,beta/4',gamma'/4,gamma/1//" valType="SMILES" value="N[C@@H](C(C)C)C(O)=O">l-val</token>
    <token labels="/2,alpha/3,beta/4,gamma////" valType="SMILES" value="N[C@@H](CCO)C(O)=O">l-homoser</token>
    <token labels="/2,alpha/3,beta/4,gamma////" valType="SMILES" value="N[C@@H](CCS)C(O)=O">l-homocyste</token>
    <token labels="/2,alpha/3,beta/4,gamma/5,delta///" valType="SMILES" value="N[C@@H](CCC)C(O)=O">l-norval</token>
    <token labels="/2,alpha/3,beta/4,gamma/5,delta/6,epsilon///" valType="SMILES" value="N[C@@H](CCCC)C(O)=O">l-norleuc</token>
    <token labels="none" valType="SMILES" value="N[C@@H](CSSCC(N)C(=O)O)C(O)=O">l-cyst</token>
  </tokenList>

  <tokenList tagname="group" type="aminoAcid" subType="endInAn" symbol="è" ><!--why isn't this tryptophine!!!!-->
    <token labels="/alpha/beta/3/2/1/7a/7/6/5/4/3a///" valType="SMILES" value="N[C@@H](Cc1cnc2ccccc12)C(O)=O">tryptoph</token>
    <token labels="/alpha/beta/3/2/1/7a/7/6/5/4/3a///" valType="SMILES" value="N[C@@H](Cc1cnc2ccccc12)C(O)=O">l-tryptoph</token>
  </tokenList>

  <tokenList tagname="group" type="aminoAcid" subType="endInIc" symbol="ï" >
    <token labels="/2,alpha/3,beta/4,delta///1//" valType="SMILES" value="N[C@@H](CC(O)=O)C(O)=O">aspart</token>
    <token labels="/2,alpha/3,beta/4,gamma/5///1//" valType="SMILES" value="N[C@@H](CCC(O)=O)C(O)=O">glutam</token>

    <token labels="/2,alpha/3,beta/4,delta///1//" valType="SMILES" value="N[C@@H](CC(O)=O)C(O)=O">l-aspart</token>
    <token labels="/2,alpha/3,beta/4,gamma/5///1//" valType="SMILES" value="N[C@@H](CCC(O)=O)C(O)=O">l-glutam</token>
  </tokenList>
</tokenLists>

  <!--<token labels="/2,alpha/3,beta/1//" valType="SMILES" value="N[C@@H](C)C(O)=O">Ala</token>
  <token labels="/2/3/4/5///omega/omega'/1//" valType="SMILES" value="N[C@@H](CCCNC(N)=N)C(O)=O">Arg</token>
  <token labels="/2,alpha/3,beta/4,delta///1//" valType="SMILES" value="N[C@@H](CC(N)=O)C(O)=O">Asn</token>
  <token labels="/2,alpha/3,beta/4,delta///1//" valType="SMILES" value="N[C@@H](CC(O)=O)C(O)=O">Asp</token>
  <token labels="/2,alpha/3,beta//1//" valType="SMILES" value="N[C@@H](CS)C(O)=O">Cys</token>
  <token labels="/2,alpha/3,beta/4,delta/5///1//" valType="SMILES" value="N[C@@H](CCC(N)=O)C(O)=O">Gln</token>
  <token labels="/2,alpha/3,beta/4,gamma/5///1//" valType="SMILES" value="N[C@@H](CCC(O)=O)C(O)=O">Glu</token>
  <token labels="/2,alpha/1//" valType="SMILES" value="NCC(O)=O">Gly</token>
  <token labels="/alpha/beta/4/5/1,tele,tau/2/3,pros,pi///" valType="SMILES" value="N[C@@H](Cc1cncn1)C(O)=O">His</token>
  <token labels="/2,alpha/3,beta/3'/4,gamma/5,delta/1//" valType="SMILES" value="N[C@@H]([C@@H](C)CC)C(O)=O">Ile</token>
  <token labels="/2,alpha/3,beta/4,gamma/5',delta'/5,delta/1//" valType="SMILES" value="N[C@@H](CC(C)C)C(O)=O">Leu</token>
  <token labels="/2,alpha/3,beta/4,gamma/5,delta/6,epsilon//1//" valType="SMILES" value="N[C@@H](CCCCN)C(O)=O">Lys</token>
  <token labels="/2,alpha/3,beta/4,gamma//methyl/1//" valType="SMILES" value="N[C@@H](CCSC)C(O)=O">Met</token>
  <token labels="/alpha/beta/1/2/3/4/5/6///" valType="SMILES" value="N[C@@H](Cc1ccccc1)C(O)=O">Phe</token>
  <token labels="///2/1/5/4/3" valType="SMILES" value="O=C(O)[C@H]1NCCC1">Pro</token>
  <token labels="/2,alpha/3,beta//1//" valType="SMILES" value="N[C@@H](CO)C(O)=O">Ser</token>
  <token labels="/2,alpha/3,beta//4,gamma/1//" valType="SMILES" value="N[C@@H]([C@H](O)C)C(O)=O">Thr</token>
  <token labels="/alpha/beta/3/2/1/7a/7/6/5/4/3a///" valType="SMILES" value="N[C@@H](Cc1cnc2ccccc12)C(O)=O">Trp</token>
  <token labels="/alpha/beta/1/2/3/4/5/6////" valType="SMILES" value="N[C@@H](Cc1ccc(cc1)O)C(O)=O">Tyr</token>
  <token labels="/2,alpha/3,beta/4',gamma'/4,gamma/1//" valType="SMILES" value="N[C@@H](C(C)C)C(O)=O">Val</token>-->
