<!DOCTYPE tokenLists SYSTEM "tokenLists.dtd">
<tokenLists>
	<tokenList tagname="chargeSpecifier" symbol="Î">
		<token value="1">(1+)</token>
		<token value="2">(2+)</token>
		<token value="3">(3+)</token>
		<token value="4">(4+)</token>
		<token value="5">(5+)</token>
		<token value="6">(6+)</token>
		<token value="7">(7+)</token>
		<token value="8">(8+)</token>
		<token value="9">(9+)</token>
		<token value="1">(+1)</token>
		<token value="2">(+2)</token>
		<token value="3">(+3)</token>
		<token value="4">(+4)</token>
		<token value="5">(+5)</token>
		<token value="6">(+6)</token>
		<token value="7">(+7)</token>
		<token value="8">(+8)</token>
		<token value="9">(+9)</token>
		<token value="-1">(-1)</token>
		<token value="-2">(-2)</token>
		<token value="-3">(-3)</token>
		<token value="-4">(-4)</token>
		<token value="-5">(-5)</token>
		<token value="-6">(-6)</token>
		<token value="-7">(-7)</token>
		<token value="-8">(-8)</token>
		<token value="-9">(-9)</token>
		<token value="-1">(1-)</token>
		<token value="-2">(2-)</token>
		<token value="-3">(3-)</token>
		<token value="-4">(4-)</token>
		<token value="-5">(5-)</token>
		<token value="-6">(6-)</token>
		<token value="-7">(7-)</token>
		<token value="-8">(8-)</token>
		<token value="-9">(9-)</token>
	</tokenList>
	<tokenList tagname="oxidationNumberSpecifier" symbol="Î">
		<token value="0">(0)</token>
		<token value="1">(i)</token>
		<token value="2">(ii)</token>
		<token value="3">(iii)</token>
		<token value="4">(iv)</token>
		<token value="5">(v)</token>
		<token value="6">(vi)</token>
		<token value="7">(vii)</token>
		<token value="8">(viii)</token>
		<token value="9">(ix)</token>
	</tokenList>
</tokenLists>
